{
  "host_id": "host-demo-app-01",
  "name": "Demo App 01",
  "hostname": "demo-app-01",
  "host_type": "server",
  "host_os": "linux",
  "host_ip": "203.0.113.108",
  "network_id": "net-demo-lab-core",
  "aliases": [
    "demo-app-01",
    "203.0.113.108"
  ],
  "roles": [
    "business-app"
  ],
  "environment": "development",
  "status": "draft",
  "description": "Reference host template with synthetic demo identifiers; not production.",
  "source_host_description": "Synthetic application host template.",
  "tags": [
    "business-app",
    "demo",
    "reference",
    "server"
  ]
}
