{
  "host_id": "host-demo-service-02",
  "name": "Demo Service 02",
  "hostname": "demo-service-02",
  "host_type": "server",
  "host_os": "linux",
  "host_ip": "203.0.113.53",
  "network_id": "net-demo-lab-core",
  "aliases": [
    "demo-service-02",
    "203.0.113.53"
  ],
  "roles": [
    "service-node"
  ],
  "environment": "development",
  "status": "draft",
  "description": "Reference host template with synthetic demo identifiers; not production.",
  "tags": [
    "demo",
    "reference",
    "server",
    "service-node"
  ],
  "source_host_description": "Synthetic service node template."
}
