{
  "host_id": "host-demo-knowledge-base-01",
  "name": "Demo Knowledge Base 01",
  "hostname": "demo-knowledge-base-01",
  "host_type": "server",
  "host_os": "linux",
  "host_ip": "203.0.113.109",
  "network_id": "net-demo-lab-core",
  "aliases": [
    "demo-knowledge-base-01",
    "203.0.113.109"
  ],
  "roles": [
    "knowledge-base"
  ],
  "environment": "development",
  "status": "draft",
  "description": "Reference host template with synthetic demo identifiers; not production.",
  "source_host_description": "Synthetic knowledge-base host template.",
  "tags": [
    "demo",
    "knowledge-base",
    "reference",
    "server"
  ]
}
