{
  "host_id": "host-demo-ci-controller-01",
  "name": "Demo CI Controller 01",
  "hostname": "demo-ci-controller-01",
  "host_type": "server",
  "host_os": "linux",
  "host_ip": "203.0.113.10",
  "network_id": "net-demo-lab-core",
  "aliases": [
    "demo-ci-controller-01",
    "203.0.113.10"
  ],
  "roles": [
    "ci-controller"
  ],
  "environment": "development",
  "status": "draft",
  "description": "Reference host template with synthetic demo identifiers; not production.",
  "source_host_description": "Synthetic CI controller template.",
  "tags": [
    "ci-controller",
    "demo",
    "reference",
    "server"
  ]
}
