{
  "host_id": "host-demo-web-exec-01",
  "name": "203.0.113.24",
  "hostname": "demo-web-exec-01",
  "host_type": "server",
  "host_os": "linux",
  "host_ip": "203.0.113.24",
  "network_id": "net-demo-lab",
  "aliases": [
    "203.0.113.24"
  ],
  "roles": [
    "web",
    "lab"
  ],
  "environment": "production",
  "status": "active",
  "description": "Lab host for direct auth.log read examples.",
  "tags": [
    "demo",
    "lab"
  ]
}
