{
  "host_id": "host-demo-deploy-01",
  "name": "Demo Deploy 01",
  "hostname": "demo-deploy-01",
  "host_type": "server",
  "host_os": "linux",
  "host_ip": "203.0.113.74",
  "network_id": "net-demo-lab-core",
  "aliases": [
    "demo-deploy-01",
    "203.0.113.74"
  ],
  "roles": [
    "deployment-automation"
  ],
  "environment": "development",
  "status": "draft",
  "description": "Reference host template with synthetic demo identifiers; not production.",
  "source_host_description": "Synthetic deployment automation host template.",
  "tags": [
    "demo",
    "deployment-automation",
    "reference",
    "server"
  ]
}
